{
  "$schema": "https://json-schema.org/draft/2020-12/schema",
  "$id": "https://nhsc.example/schemas/stability/template.schema.json",
  "title": "Questionnaire template document (config container)",
  "type": "object",
  "required": [
    "templateId",
    "templateName",
    "formulationClass",
    "version",
    "status",
    "sections"
  ],
  "properties": {
    "templateId": {
      "type": "string",
      "pattern": "^TPL_[A-Z0-9_]+$"
    },
    "templateName": {
      "type": "string",
      "maxLength": 200
    },
    "formulationClass": {
      "enum": [
        "LIQUID_RTD",
        "POWDER",
        "VMS"
      ]
    },
    "version": {
      "type": "integer",
      "minimum": 1
    },
    "status": {
      "enum": [
        "DRAFT",
        "ACTIVE",
        "RETIRED"
      ]
    },
    "description": {
      "type": "string"
    },
    "createdBy": {
      "type": "string"
    },
    "createdAt": {
      "type": "string"
    },
    "sections": {
      "type": "array",
      "minItems": 1,
      "items": {
        "type": "object",
        "required": [
          "label",
          "fields"
        ],
        "properties": {
          "label": {
            "type": "string"
          },
          "fields": {
            "type": "array",
            "items": {
              "type": "string",
              "enum": [
                "project_code",
                "ar_number",
                "trial_number",
                "variant_number",
                "sample_code",
                "time_point",
                "temperature_condition",
                "formulation_class",
                "product_format",
                "container_type",
                "package_volume_ml",
                "package_fill_height_mm",
                "sample_storage_orientation",
                "sample_temperature_at_test",
                "sample_opened_previously",
                "shake_protocol",
                "shake_count",
                "result_type",
                "plan_status",
                "observer_user_id",
                "observation_timestamp",
                "test_status",
                "overall_result",
                "exclude_from_trend",
                "exclude_reason",
                "overall_comments",
                "lab_source",
                "lab_lims_reference",
                "lab_ph",
                "lab_visc1_value",
                "lab_visc1_instrument",
                "lab_visc1_geometry",
                "lab_visc1_shear_rate",
                "lab_visc1_temp_c",
                "lab_visc2_value",
                "lab_visc2_instrument",
                "lab_visc2_geometry",
                "lab_visc2_shear_rate",
                "lab_visc2_temp_c",
                "lab_brix",
                "lab_particle_size_d50_um",
                "lab_measured_at",
                "general_overview_photo",
                "general_empty_bottle_photo",
                "general_beaker_photo",
                "general_pour_out_video",
                "homog_unshaken_homogeneous",
                "homog_unshaken_appearance",
                "homog_unshaken_photo",
                "homog_shaken_test_performed",
                "homog_shaken_homogeneous",
                "homog_post_shake_color_change",
                "homog_post_shake_color_description",
                "homog_post_shake_color_code",
                "homog_shaken_photo",
                "homog_comments",
                "cream_unsh_present",
                "cream_unsh_rating",
                "cream_unsh_layer_measurable",
                "cream_unsh_layer_thickness_value",
                "cream_unsh_layer_thickness_unit",
                "cream_unsh_layer_description",
                "cream_unsh_layer_color",
                "cream_unsh_marbling_present",
                "cream_unsh_minor_spots_present",
                "cream_unsh_surface_volume_pct",
                "cream_unsh_pour_exit_time_s",
                "cream_unsh_photo",
                "cream_unsh_pour_out_video",
                "cream_unsh_pour_out_result",
                "cream_sh_shakes_in",
                "cream_sh_rating",
                "cream_sh_result",
                "cream_sh_residue_type",
                "cream_sh_residual_pct",
                "cream_sh_photo",
                "cream_emulsifier_flag",
                "cream_rim_dried_residue_present",
                "cream_rim_residue_fatty",
                "cream_market_restriction_flag",
                "cream_review_prompt",
                "cream_comments",
                "serum_unsh_present",
                "serum_unsh_rating",
                "serum_unsh_measurable",
                "serum_unsh_value",
                "serum_unsh_unit",
                "serum_unsh_pct_package_volume",
                "serum_unsh_locations",
                "serum_unsh_clarity",
                "serum_unsh_color",
                "serum_unsh_photo",
                "serum_sh_shakes_in",
                "serum_sh_rating",
                "serum_sh_value",
                "serum_sh_unit",
                "serum_sh_result",
                "serum_sh_photo",
                "serum_gelation_flag",
                "serum_protein_flag",
                "serum_resep_check_performed",
                "serum_resep_hours_after_shake",
                "serum_resep_present",
                "serum_resep_rating",
                "serum_resep_photo",
                "serum_scale_up_viscosity_warning",
                "serum_review_prompt",
                "serum_comments",
                "sed_unsh_present",
                "sed_unsh_rating",
                "sed_unsh_height_value",
                "sed_unsh_height_unit",
                "sed_unsh_coverage",
                "sed_unsh_texture",
                "sed_measurement_point",
                "sed_measurement_location",
                "sed_weight_g",
                "sed_bottle_cut_to_evaluate",
                "sed_bottle_coating_present",
                "sed_unsh_photo",
                "sed_predominant_type",
                "sed_prot_review_prompt",
                "sed_min_appearance",
                "sed_min_review_prompt",
                "sed_coc_ring_present",
                "sed_coc_settling_pct_volume",
                "sed_coc_review_prompt",
                "sed_sh_rating",
                "sed_sh_height_value",
                "sed_sh_height_unit",
                "sed_sh_shake_in_extent",
                "sed_sh_lumps_present",
                "sed_sh_photo",
                "sed_composition_test_requested",
                "sed_comments",
                "gel_gelled",
                "gel_type",
                "gel_too_thick_to_pour",
                "gel_firmness",
                "gel_shake_test_performed",
                "gel_reversibility",
                "gel_spoilage_related",
                "gel_observations",
                "gel_photo",
                "gel_comments",
                "nh_rippling_present",
                "nh_lumps_present",
                "nh_lumps_severity",
                "nh_lumps_context",
                "nh_lumps_size_class",
                "nh_sieve_used",
                "nh_sieve_mesh",
                "nh_curdling_present",
                "nh_smooth_after_shaking",
                "nh_spoilage_related",
                "nh_pour_video",
                "nh_photo",
                "nh_comments",
                "psag_vertical_stripes_present",
                "psag_stripe_coverage",
                "psag_photo",
                "psag_comments",
                "app_color_change_vs_t0",
                "app_color_method",
                "app_color_l",
                "app_color_a",
                "app_color_b",
                "sens_recorded",
                "sens_texture",
                "sens_notes",
                "custom1_name",
                "custom1_unshaken",
                "custom1_shaken",
                "custom2_name",
                "custom2_unshaken",
                "custom2_shaken",
                "custom3_name",
                "custom3_unshaken",
                "custom3_shaken",
                "pwd_caking",
                "pwd_flowability",
                "pwd_color_change",
                "pwd_lumps_present",
                "pwd_wettability_s",
                "pwd_dissolution_s",
                "pwd_foaming",
                "pwd_photo",
                "vms_appearance_change",
                "vms_surface_mottling",
                "vms_chipping_capping",
                "vms_hardness_kp",
                "vms_disintegration_min",
                "vms_odor_change",
                "vms_capsule_leakage",
                "vms_photo"
              ]
            }
          },
          "requiredOverrides": {
            "type": "object",
            "additionalProperties": {
              "type": "boolean"
            }
          }
        }
      }
    }
  }
}